{
  "schema_version": "1.1.0",
  "run_id": "validation_01M25J5Y6DN9M8909A0GQ3HAKJ",
  "intent_id": "intent:validation_01M25J5Y6DN9M8909A0GQ3HAKJ",
  "task_id": "todo_01m24v",
  "original_intent": "Produce proof artifacts for a repository validation completion.",
  "derived_intent": "Run the bounded validation gates and bind the successful receipt to a trajectory.",
  "destination": "validation completion",
  "current_phase": "verification",
  "next_transitions": [
    "publish"
  ],
  "active_boundaries": [
    "Repository validation and tracked proof artifacts"
  ],
  "repo_scope": [
    ".decapod/governance/trajectory.json",
    ".decapod/governance/validation.json"
  ],
  "inspected_files": [
    "Cargo.lock",
    "Cargo.toml",
    "docs/book/src/reference/cli.md",
    "docs/book/src/reference/errors.md",
    "docs/book/src/reference/propodus.md",
    "src/decapod/cli.rs",
    "src/decapod/core/dactyl.rs",
    "src/decapod/core/dactyl_db.rs",
    "src/decapod/core/dactyl_todo.rs",
    "src/decapod/core/error.rs",
    "src/decapod/core/pool.rs",
    "src/decapod/core/storage_lock.rs",
    "src/decapod/lib.rs"
  ],
  "modified_files": [
    ".decapod/governance/trajectory.json",
    ".decapod/governance/validation.json",
    ".decapod/managed/specs/ARCHITECTURE.md",
    ".decapod/managed/specs/INTENT.md",
    ".decapod/managed/specs/INTERFACES.md",
    "tests/sqlite_maintenance.rs"
  ],
  "declared_commands": [
    "cargo bench --locked --all-features --no-run",
    "cargo check --locked --all-targets --all-features",
    "cargo clippy --locked --all-targets --all-features -- -D warnings",
    "cargo test --locked --lib --tests --all-features -- --test-threads=1",
    "decapod validate"
  ],
  "tool_calls": [],
  "checks": [
    {
      "name": "all_targets_compile",
      "status": "passed"
    },
    {
      "name": "benchmark_targets_compile",
      "status": "passed"
    },
    {
      "name": "clippy",
      "status": "passed"
    },
    {
      "name": "container_workspace",
      "status": "unavailable"
    },
    {
      "name": "dactyl_maintenance_tests",
      "status": "passed"
    },
    {
      "name": "decapod validate",
      "status": "passed"
    },
    {
      "name": "format",
      "status": "passed"
    },
    {
      "name": "lib_and_integration_tests",
      "status": "passed"
    }
  ],
  "evidence": [
    "Dactyl v0.10.0 native verification, backup, and logical recovery exercised by tests/sqlite_maintenance.rs",
    "Full serialized library and integration suite passed; benchmark targets compiled without running Criterion",
    "Podman VM start and governed container workspace retry both failed because the configured endpoint remained unavailable",
    "validation epoch ve_6a58210d2a55ccd0 completed with zero failures"
  ],
  "shortcut_risk_signals": [],
  "unresolved_assumptions": [
    "Hosted CI must provide the unavailable container-backed governance proof before completion"
  ],
  "proof_status": "partial",
  "verdicts": {
    "intent_alignment": "supported",
    "boundary_discipline": "supported",
    "shortcut_risk": "supported",
    "completion_proof": "caution"
  },
  "artifact_hash": "sha256:0fdf747fbaf0a4b1c49b2f3949345c6c60708b1b44a32a885587ec19b71afa1b",
  "custody": {
    "schema_version": "1.0.0",
    "intents": {
      "intent:validation_01M25J5Y6DN9M8909A0GQ3HAKJ": {
        "id": "intent:validation_01M25J5Y6DN9M8909A0GQ3HAKJ",
        "raw_intent": "Produce proof artifacts for a repository validation completion.",
        "refined_intent": "Run the bounded validation gates and bind the successful receipt to a trajectory.",
        "acceptance_criteria": [],
        "constraints": [
          ".decapod/governance/trajectory.json",
          ".decapod/governance/validation.json"
        ],
        "assumptions": [],
        "boundaries": [
          "Repository validation and tracked proof artifacts"
        ],
        "out_of_scope": [],
        "proof_requirements": [],
        "status": "refined",
        "created_sequence": 1,
        "updated_sequence": 3
      }
    },
    "events": [
      {
        "sequence": 2,
        "event_id": "event:2",
        "intent_id": "intent:validation_01M25J5Y6DN9M8909A0GQ3HAKJ",
        "kind": "created"
      },
      {
        "sequence": 3,
        "event_id": "event:3",
        "intent_id": "intent:validation_01M25J5Y6DN9M8909A0GQ3HAKJ",
        "kind": "refined"
      },
      {
        "sequence": 4,
        "event_id": "event:4",
        "intent_id": "intent:validation_01M25J5Y6DN9M8909A0GQ3HAKJ",
        "kind": "trajectory_step_recorded",
        "detail": "trajectory:validation_01M25J5Y6DN9M8909A0GQ3HAKJ"
      },
      {
        "sequence": 5,
        "event_id": "event:5",
        "intent_id": "intent:validation_01M25J5Y6DN9M8909A0GQ3HAKJ",
        "kind": "trajectory_step_recorded",
        "detail": "trajectory:validation_01M25J5Y6DN9M8909A0GQ3HAKJ"
      }
    ],
    "trajectories": {
      "validation_01M25J5Y6DN9M8909A0GQ3HAKJ": {
        "id": "validation_01M25J5Y6DN9M8909A0GQ3HAKJ",
        "intent_id": "intent:validation_01M25J5Y6DN9M8909A0GQ3HAKJ",
        "evidence_only": true,
        "steps": [
          {
            "sequence": 4,
            "action": "validation",
            "command": "decapod validate",
            "scope": [
              ".decapod/governance/trajectory.json",
              ".decapod/governance/validation.json"
            ],
            "observations": [
              ".decapod/governance/trajectory.json",
              ".decapod/governance/validation.json",
              "validation epoch ve_6a58210d2a55ccd0 completed with zero failures"
            ],
            "proof_refs": [
              "decapod validate"
            ],
            "validation_findings": [],
            "custody_event_id": "event:4"
          },
          {
            "sequence": 5,
            "action": "verification",
            "command": "cargo test --locked --lib --tests --all-features -- --test-threads=1",
            "scope": [
              ".decapod/governance/trajectory.json",
              ".decapod/governance/validation.json"
            ],
            "observations": [
              "Cargo.toml",
              "Cargo.lock",
              "src/decapod/core/dactyl.rs",
              "src/decapod/core/dactyl_db.rs",
              "src/decapod/core/dactyl_todo.rs",
              "src/decapod/core/pool.rs",
              "src/decapod/core/storage_lock.rs",
              "src/decapod/core/error.rs",
              "src/decapod/cli.rs",
              "src/decapod/lib.rs",
              "docs/book/src/reference/cli.md",
              "docs/book/src/reference/errors.md",
              "docs/book/src/reference/propodus.md",
              "tests/sqlite_maintenance.rs",
              ".decapod/managed/specs/INTENT.md",
              ".decapod/managed/specs/ARCHITECTURE.md",
              ".decapod/managed/specs/INTERFACES.md",
              "Dactyl v0.10.0 native verification, backup, and logical recovery exercised by tests/sqlite_maintenance.rs",
              "Full serialized library and integration suite passed; benchmark targets compiled without running Criterion",
              "Podman VM start and governed container workspace retry both failed because the configured endpoint remained unavailable"
            ],
            "proof_refs": [
              "dactyl_maintenance_tests",
              "lib_and_integration_tests",
              "all_targets_compile",
              "benchmark_targets_compile",
              "format",
              "clippy",
              "container_workspace"
            ],
            "validation_findings": [
              "Hosted CI must provide the unavailable container-backed governance proof before completion"
            ],
            "custody_event_id": "event:5"
          }
        ]
      }
    },
    "summaries": {},
    "knowledge_candidates": [],
    "next_sequence": 5
  }
}