{
  "schema_version": "1.1.0",
  "run_id": "feat_01m21cd0bxsq9evt",
  "intent_id": "intent:feat_01m21cd0bxsq9evt",
  "task_id": "feat_01m21cd0bxsq9evt",
  "original_intent": "Implement the maintainable single-workspace trajectory and SQLite coordination solution for GitHub issues #1312 and #1313.",
  "derived_intent": "Preserve one authoritative current trajectory per workspace, archive prior evidence, coordinate canonical local datastore access across cooperating Decapod processes, and document the Dactyl recovery boundary.",
  "destination": "single PR for issues #1312 and #1313",
  "current_phase": "validation",
  "next_transitions": [
    "publish",
    "validate"
  ],
  "active_boundaries": [
    "canonical local Dactyl datastore coordination",
    "one active trajectory authority per agent workspace"
  ],
  "repo_scope": [
    ".decapod/managed/specs",
    "Cargo.lock",
    "Cargo.toml",
    "src/decapod/core/dactyl.rs",
    "src/decapod/core/dactyl_db.rs",
    "src/decapod/core/db.rs",
    "src/decapod/core/pool.rs",
    "src/decapod/core/storage_lock.rs",
    "src/decapod/core/trajectory.rs",
    "tests/sqlite_hardening.rs"
  ],
  "inspected_files": [],
  "modified_files": [
    ".decapod/governance/trajectory.json",
    ".decapod/governance/validation.json"
  ],
  "declared_commands": [
    "decapod validate"
  ],
  "tool_calls": [],
  "checks": [
    {
      "name": "decapod validate",
      "status": "passed"
    }
  ],
  "evidence": [
    "validation epoch ve_108abc4570237f6d completed with zero failures"
  ],
  "shortcut_risk_signals": [],
  "unresolved_assumptions": [],
  "proof_status": "passed",
  "verdicts": {
    "intent_alignment": "supported",
    "boundary_discipline": "supported",
    "shortcut_risk": "supported",
    "completion_proof": "supported"
  },
  "artifact_hash": "sha256:29361dc1449641ec1da365c2fa9c742cad189a086927ec0b8fad7c1efda18b85",
  "custody": {
    "schema_version": "1.0.0",
    "intents": {
      "intent:feat_01m21cd0bxsq9evt": {
        "id": "intent:feat_01m21cd0bxsq9evt",
        "raw_intent": "Implement the maintainable single-workspace trajectory and SQLite coordination solution for GitHub issues #1312 and #1313.",
        "refined_intent": "Preserve one authoritative current trajectory per workspace, archive prior evidence, coordinate canonical local datastore access across cooperating Decapod processes, and document the Dactyl recovery boundary.",
        "acceptance_criteria": [],
        "constraints": [
          "src/decapod/core/trajectory.rs",
          "src/decapod/core/storage_lock.rs",
          "src/decapod/core/db.rs",
          "src/decapod/core/dactyl.rs",
          "src/decapod/core/dactyl_db.rs",
          "src/decapod/core/pool.rs",
          "tests/sqlite_hardening.rs",
          ".decapod/managed/specs",
          "Cargo.toml",
          "Cargo.lock"
        ],
        "assumptions": [],
        "boundaries": [
          "one active trajectory authority per agent workspace",
          "canonical local Dactyl datastore coordination"
        ],
        "out_of_scope": [],
        "proof_requirements": [],
        "status": "refined",
        "created_sequence": 1,
        "updated_sequence": 3
      }
    },
    "events": [
      {
        "sequence": 2,
        "event_id": "event:2",
        "intent_id": "intent:feat_01m21cd0bxsq9evt",
        "kind": "created"
      },
      {
        "sequence": 3,
        "event_id": "event:3",
        "intent_id": "intent:feat_01m21cd0bxsq9evt",
        "kind": "refined"
      },
      {
        "sequence": 4,
        "event_id": "event:4",
        "intent_id": "intent:feat_01m21cd0bxsq9evt",
        "kind": "trajectory_step_recorded",
        "detail": "trajectory:feat_01m21cd0bxsq9evt"
      }
    ],
    "trajectories": {
      "feat_01m21cd0bxsq9evt": {
        "id": "feat_01m21cd0bxsq9evt",
        "intent_id": "intent:feat_01m21cd0bxsq9evt",
        "evidence_only": true,
        "steps": [
          {
            "sequence": 4,
            "action": "validation",
            "command": "decapod validate",
            "scope": [
              ".decapod/managed/specs",
              "Cargo.lock",
              "Cargo.toml",
              "src/decapod/core/dactyl.rs",
              "src/decapod/core/dactyl_db.rs",
              "src/decapod/core/db.rs",
              "src/decapod/core/pool.rs",
              "src/decapod/core/storage_lock.rs",
              "src/decapod/core/trajectory.rs",
              "tests/sqlite_hardening.rs"
            ],
            "observations": [
              ".decapod/governance/trajectory.json",
              ".decapod/governance/validation.json",
              "validation epoch ve_108abc4570237f6d completed with zero failures"
            ],
            "proof_refs": [
              "decapod validate"
            ],
            "validation_findings": [],
            "custody_event_id": "event:4"
          }
        ]
      }
    },
    "summaries": {},
    "knowledge_candidates": [],
    "next_sequence": 4
  }
}