{
  "schema_version": "1.1.0",
  "run_id": "seth-issues-01m2kbchkg3f62s7",
  "intent_id": "intent:seth-issues-01m2kbchkg3f62s7",
  "task_id": "bugs_01m2kbchkg3f62s7",
  "original_intent": "Solve verified governance and scaffolding issues #1093, #1163, #1219, and #1324-#1327 in one reviewable PR.",
  "derived_intent": "Preserve Decapod ownership boundaries, make authority and proof currency explicit, keep minimal overrides deterministic, and provide an explicit research-ledger compaction surface.",
  "destination": "single PR for seven connected issues",
  "current_phase": "validation",
  "next_transitions": [
    "publish"
  ],
  "active_boundaries": [
    "Do not alter the closed research-claims schema or silently rebind stale validation evidence.",
    "Only modify the isolated worktree and Decapod-owned state through supported CLI paths."
  ],
  "repo_scope": [
    ".decapod/README.md; .decapod/OVERRIDE.md scaffolding; claims/Health Engine docs and inventory; specs config-input hash; validation epoch proof; living specs and regression tests"
  ],
  "inspected_files": [
    ".decapod/config.toml",
    "docs/book/src/concepts/constitution.md",
    "src/decapod/core/assets.rs",
    "src/decapod/core/governance_artifacts.rs",
    "src/decapod/core/project_specs.rs",
    "src/decapod/core/research_claims.rs",
    "src/decapod/core/validate.rs",
    "src/decapod/lib.rs"
  ],
  "modified_files": [
    ".decapod/README.md",
    ".decapod/managed/specs/ARCHITECTURE.md",
    ".decapod/managed/specs/INTENT.md",
    ".decapod/managed/specs/INTERFACES.md",
    ".decapod/managed/specs/VALIDATION.md",
    "src/decapod/cli.rs",
    "src/decapod/core/assets.rs",
    "src/decapod/core/docs_cli.rs",
    "src/decapod/core/governance_artifacts.rs",
    "src/decapod/core/research_claims.rs",
    "src/decapod/core/validate.rs",
    "src/decapod/lib.rs",
    "tests/core/core.rs",
    "tests/governance_artifacts.rs",
    "tests/init_validate_green_field.rs",
    "tests/unit/core/project_specs_tests.rs",
    "tests/unit/lib_validation_proof_tests.rs"
  ],
  "declared_commands": [
    "cargo test --lib",
    "cargo test --test core_tests -- --skip broker_allows_parallel_ops_on_different_databases",
    "cargo test --test governance_artifacts",
    "cargo test --test init_validate_green_field"
  ],
  "tool_calls": [],
  "checks": [
    {
      "name": "cargo test --lib",
      "status": "passed"
    },
    {
      "name": "cargo test --test governance_artifacts",
      "status": "passed"
    },
    {
      "name": "cargo test --test init_validate_green_field",
      "status": "passed"
    },
    {
      "name": "focused core_tests",
      "status": "passed"
    }
  ],
  "evidence": [
    "Focused regression suites pass; the full core target was not used as a completion check because its pre-existing parallel-database test did not terminate in the local run."
  ],
  "shortcut_risk_signals": [],
  "unresolved_assumptions": [],
  "proof_status": "passed",
  "verdicts": {
    "intent_alignment": "supported",
    "boundary_discipline": "supported",
    "shortcut_risk": "supported",
    "completion_proof": "supported"
  },
  "artifact_hash": "sha256:0be7185f562888253ae80b0bb8817d7776bb919cadeb61a1e91bea687f334b7b",
  "custody": {
    "schema_version": "1.0.0",
    "intents": {
      "intent:seth-issues-01m2kbchkg3f62s7": {
        "id": "intent:seth-issues-01m2kbchkg3f62s7",
        "raw_intent": "Solve verified governance and scaffolding issues #1093, #1163, #1219, and #1324-#1327 in one reviewable PR.",
        "refined_intent": "Preserve Decapod ownership boundaries, make authority and proof currency explicit, keep minimal overrides deterministic, and provide an explicit research-ledger compaction surface.",
        "acceptance_criteria": [],
        "constraints": [
          ".decapod/README.md; .decapod/OVERRIDE.md scaffolding; claims/Health Engine docs and inventory; specs config-input hash; validation epoch proof; living specs and regression tests"
        ],
        "assumptions": [],
        "boundaries": [
          "Do not alter the closed research-claims schema or silently rebind stale validation evidence.",
          "Only modify the isolated worktree and Decapod-owned state through supported CLI paths."
        ],
        "out_of_scope": [],
        "proof_requirements": [],
        "status": "refined",
        "created_sequence": 1,
        "updated_sequence": 3
      }
    },
    "events": [
      {
        "sequence": 2,
        "event_id": "event:2",
        "intent_id": "intent:seth-issues-01m2kbchkg3f62s7",
        "kind": "created"
      },
      {
        "sequence": 3,
        "event_id": "event:3",
        "intent_id": "intent:seth-issues-01m2kbchkg3f62s7",
        "kind": "refined"
      },
      {
        "sequence": 4,
        "event_id": "event:4",
        "intent_id": "intent:seth-issues-01m2kbchkg3f62s7",
        "kind": "trajectory_step_recorded",
        "detail": "trajectory:seth-issues-01m2kbchkg3f62s7"
      }
    ],
    "trajectories": {
      "seth-issues-01m2kbchkg3f62s7": {
        "id": "seth-issues-01m2kbchkg3f62s7",
        "intent_id": "intent:seth-issues-01m2kbchkg3f62s7",
        "evidence_only": true,
        "steps": [
          {
            "sequence": 4,
            "action": "validation",
            "command": "cargo test --lib",
            "scope": [
              ".decapod/README.md; .decapod/OVERRIDE.md scaffolding; claims/Health Engine docs and inventory; specs config-input hash; validation epoch proof; living specs and regression tests"
            ],
            "observations": [
              "src/decapod/core/assets.rs",
              "src/decapod/core/research_claims.rs",
              "src/decapod/core/governance_artifacts.rs",
              "src/decapod/core/project_specs.rs",
              "src/decapod/core/validate.rs",
              "src/decapod/lib.rs",
              "docs/book/src/concepts/constitution.md",
              ".decapod/config.toml",
              "src/decapod/core/assets.rs",
              "src/decapod/core/docs_cli.rs",
              "src/decapod/core/governance_artifacts.rs",
              "src/decapod/core/research_claims.rs",
              "src/decapod/core/validate.rs",
              "src/decapod/lib.rs",
              "src/decapod/cli.rs",
              "tests/core/core.rs",
              "tests/governance_artifacts.rs",
              "tests/init_validate_green_field.rs",
              "tests/unit/core/project_specs_tests.rs",
              "tests/unit/lib_validation_proof_tests.rs",
              ".decapod/managed/specs/INTENT.md",
              ".decapod/managed/specs/ARCHITECTURE.md",
              ".decapod/managed/specs/INTERFACES.md",
              ".decapod/managed/specs/VALIDATION.md",
              ".decapod/README.md",
              "Focused regression suites pass; the full core target was not used as a completion check because its pre-existing parallel-database test did not terminate in the local run."
            ],
            "proof_refs": [
              "cargo test --lib",
              "cargo test --test governance_artifacts",
              "cargo test --test init_validate_green_field",
              "focused core_tests"
            ],
            "validation_findings": [],
            "custody_event_id": "event:4"
          }
        ]
      }
    },
    "summaries": {},
    "knowledge_candidates": [],
    "next_sequence": 4
  }
}