{
  "schema_version": "1.1.0",
  "run_id": "issue-1360-final-20261001",
  "intent_id": "intent:issue-1360-final-20261001",
  "task_id": "bugs_01m3vmyw1npwaa74",
  "original_intent": "Solve Decapod Issue #1360 and publish a pull request.",
  "derived_intent": "Prevent SQLite WAL corruption from host and Linux VM processes sharing virtiofs state by giving container workspaces an isolated local database snapshot and rejecting unsupported shared filesystems.",
  "current_phase": "validation",
  "next_transitions": [
    "publish"
  ],
  "active_boundaries": [
    "Work only in the dedicated Decapod worktree. Preserve the original machine database through supported Dactyl maintenance. Do not access SQLite files directly."
  ],
  "repo_scope": [
    "src/decapod/core/db.rs; src/decapod/core/workspace.rs; living specs; required governance and release artifacts."
  ],
  "inspected_files": [
    "src/decapod/core/db.rs",
    "src/decapod/core/workspace.rs"
  ],
  "modified_files": [
    ".decapod/governance/trajectory.json",
    ".decapod/governance/validation.json",
    ".decapod/managed/specs/ARCHITECTURE.md",
    ".decapod/managed/specs/INTENT.md",
    ".decapod/managed/specs/INTERFACES.md",
    ".decapod/managed/specs/OPERATIONS.md",
    "src/decapod/core/db.rs",
    "src/decapod/core/workspace.rs"
  ],
  "declared_commands": [
    "cargo test --locked --lib",
    "decapod validate",
    "decapod validate --refresh-specs --format json (containerized)"
  ],
  "tool_calls": [
    "decapod data database recover succeeded; preserved original database archive at .decapod/data/decapod.db.issue1360-corrupt-20261001"
  ],
  "checks": [
    {
      "name": "cargo test --locked --lib",
      "status": "passed"
    },
    {
      "name": "decapod validate",
      "status": "passed"
    },
    {
      "name": "decapod validate --refresh-specs",
      "status": "passed"
    }
  ],
  "evidence": [
    "cargo test --locked --lib: 357 passed, 0 failed",
    "validation epoch ve_be591248f79c4bb9 completed with zero failures",
    "validation_epoch:ve_be591248f79c4bb9"
  ],
  "shortcut_risk_signals": [],
  "unresolved_assumptions": [],
  "proof_status": "passed",
  "verdicts": {
    "intent_alignment": "supported",
    "boundary_discipline": "supported",
    "shortcut_risk": "supported",
    "completion_proof": "supported"
  },
  "artifact_hash": "sha256:f8ed5ffc44efb158076551e45b1bbaebb68f8ebd2b84a87c8264d677dd38b312",
  "custody": {
    "schema_version": "1.0.0",
    "intents": {
      "intent:issue-1360-final-20261001": {
        "id": "intent:issue-1360-final-20261001",
        "raw_intent": "Solve Decapod Issue #1360 and publish a pull request.",
        "refined_intent": "Prevent SQLite WAL corruption from host and Linux VM processes sharing virtiofs state by giving container workspaces an isolated local database snapshot and rejecting unsupported shared filesystems.",
        "acceptance_criteria": [],
        "constraints": [
          "src/decapod/core/db.rs; src/decapod/core/workspace.rs; living specs; required governance and release artifacts."
        ],
        "assumptions": [],
        "boundaries": [
          "Work only in the dedicated Decapod worktree. Preserve the original machine database through supported Dactyl maintenance. Do not access SQLite files directly."
        ],
        "out_of_scope": [],
        "proof_requirements": [],
        "status": "refined",
        "created_sequence": 1,
        "updated_sequence": 3
      }
    },
    "events": [
      {
        "sequence": 2,
        "event_id": "event:2",
        "intent_id": "intent:issue-1360-final-20261001",
        "kind": "created"
      },
      {
        "sequence": 3,
        "event_id": "event:3",
        "intent_id": "intent:issue-1360-final-20261001",
        "kind": "refined"
      },
      {
        "sequence": 4,
        "event_id": "event:4",
        "intent_id": "intent:issue-1360-final-20261001",
        "kind": "trajectory_step_recorded",
        "detail": "trajectory:issue-1360-final-20261001"
      },
      {
        "sequence": 5,
        "event_id": "event:5",
        "intent_id": "intent:issue-1360-final-20261001",
        "kind": "trajectory_step_recorded",
        "detail": "trajectory:issue-1360-final-20261001"
      }
    ],
    "trajectories": {
      "issue-1360-final-20261001": {
        "id": "issue-1360-final-20261001",
        "intent_id": "intent:issue-1360-final-20261001",
        "evidence_only": true,
        "steps": [
          {
            "sequence": 4,
            "action": "validation",
            "command": "decapod validate",
            "scope": [
              "src/decapod/core/db.rs; src/decapod/core/workspace.rs; living specs; required governance and release artifacts."
            ],
            "observations": [
              ".decapod/governance/trajectory.json",
              ".decapod/governance/validation.json",
              "validation epoch ve_be591248f79c4bb9 completed with zero failures"
            ],
            "proof_refs": [
              "decapod validate"
            ],
            "validation_findings": [],
            "custody_event_id": "event:4"
          },
          {
            "sequence": 5,
            "action": "trajectory.record",
            "tool": "decapod data database recover succeeded; preserved original database archive at .decapod/data/decapod.db.issue1360-corrupt-20261001",
            "command": "cargo test --locked --lib",
            "scope": [
              "src/decapod/core/db.rs; src/decapod/core/workspace.rs; living specs; required governance and release artifacts."
            ],
            "observations": [
              "src/decapod/core/db.rs",
              "src/decapod/core/workspace.rs",
              "src/decapod/core/db.rs",
              "src/decapod/core/workspace.rs",
              ".decapod/managed/specs/INTENT.md",
              ".decapod/managed/specs/ARCHITECTURE.md",
              ".decapod/managed/specs/INTERFACES.md",
              ".decapod/managed/specs/OPERATIONS.md",
              "validation_epoch:ve_be591248f79c4bb9",
              "cargo test --locked --lib: 357 passed, 0 failed"
            ],
            "proof_refs": [
              "cargo test --locked --lib",
              "decapod validate --refresh-specs"
            ],
            "validation_findings": [],
            "custody_event_id": "event:5"
          }
        ]
      }
    },
    "summaries": {},
    "knowledge_candidates": [],
    "next_sequence": 5
  }
}