{
  "schema_version": "1.1.0",
  "run_id": "validation_01M215EE270N4TRXN7MCYYGSQB",
  "intent_id": "intent:validation_01M215EE270N4TRXN7MCYYGSQB",
  "task_id": "todo_01m1zn",
  "original_intent": "Produce proof artifacts for a repository validation completion.",
  "derived_intent": "Run the bounded validation gates and bind the successful receipt to a trajectory.",
  "destination": "validation completion",
  "current_phase": "validation",
  "next_transitions": [
    "publish"
  ],
  "active_boundaries": [
    "Repository validation and tracked proof artifacts"
  ],
  "repo_scope": [
    ".decapod/governance/trajectory.json",
    ".decapod/governance/validation.json"
  ],
  "inspected_files": [],
  "modified_files": [
    ".decapod/governance/trajectory.json",
    ".decapod/governance/validation.json"
  ],
  "declared_commands": [
    "decapod validate"
  ],
  "tool_calls": [],
  "checks": [
    {
      "name": "decapod validate",
      "status": "passed"
    }
  ],
  "evidence": [
    "validation epoch ve_1cdc8c6b3ee9e47b completed with zero failures"
  ],
  "shortcut_risk_signals": [],
  "unresolved_assumptions": [],
  "proof_status": "passed",
  "verdicts": {
    "intent_alignment": "supported",
    "boundary_discipline": "supported",
    "shortcut_risk": "supported",
    "completion_proof": "supported"
  },
  "artifact_hash": "sha256:935599c42c3b8ca0b5bc24e52733eeb46a5918768a0ce137806914714150c0e2",
  "custody": {
    "schema_version": "1.0.0",
    "intents": {
      "intent:validation_01M215EE270N4TRXN7MCYYGSQB": {
        "id": "intent:validation_01M215EE270N4TRXN7MCYYGSQB",
        "raw_intent": "Produce proof artifacts for a repository validation completion.",
        "refined_intent": "Run the bounded validation gates and bind the successful receipt to a trajectory.",
        "acceptance_criteria": [],
        "constraints": [
          ".decapod/governance/trajectory.json",
          ".decapod/governance/validation.json"
        ],
        "assumptions": [],
        "boundaries": [
          "Repository validation and tracked proof artifacts"
        ],
        "out_of_scope": [],
        "proof_requirements": [],
        "status": "refined",
        "created_sequence": 1,
        "updated_sequence": 3
      }
    },
    "events": [
      {
        "sequence": 2,
        "event_id": "event:2",
        "intent_id": "intent:validation_01M215EE270N4TRXN7MCYYGSQB",
        "kind": "created"
      },
      {
        "sequence": 3,
        "event_id": "event:3",
        "intent_id": "intent:validation_01M215EE270N4TRXN7MCYYGSQB",
        "kind": "refined"
      },
      {
        "sequence": 4,
        "event_id": "event:4",
        "intent_id": "intent:validation_01M215EE270N4TRXN7MCYYGSQB",
        "kind": "trajectory_step_recorded",
        "detail": "trajectory:validation_01M215EE270N4TRXN7MCYYGSQB"
      }
    ],
    "trajectories": {
      "validation_01M215EE270N4TRXN7MCYYGSQB": {
        "id": "validation_01M215EE270N4TRXN7MCYYGSQB",
        "intent_id": "intent:validation_01M215EE270N4TRXN7MCYYGSQB",
        "evidence_only": true,
        "steps": [
          {
            "sequence": 4,
            "action": "validation",
            "command": "decapod validate",
            "scope": [
              ".decapod/governance/trajectory.json",
              ".decapod/governance/validation.json"
            ],
            "observations": [
              ".decapod/governance/trajectory.json",
              ".decapod/governance/validation.json",
              "validation epoch ve_1cdc8c6b3ee9e47b completed with zero failures"
            ],
            "proof_refs": [
              "decapod validate"
            ],
            "validation_findings": [],
            "custody_event_id": "event:4"
          }
        ]
      }
    },
    "summaries": {},
    "knowledge_candidates": [],
    "next_sequence": 4
  }
}