{
  "schema_version": "1.1.0",
  "run_id": "feat_01m21n87eetm9caa",
  "intent_id": "intent:feat_01m21n87eetm9caa",
  "task_id": "feat_01m21n87eetm9caa",
  "original_intent": "Solve GitHub issue #1197 in a dedicated PR only if the solution fits the existing Decapod design: daemonless, workspace-isolated, agent-authored living specs, CLI-governed machine state, and proof-gated publication.",
  "derived_intent": "Narrow the generated instruction contract so agents may author semantic prose in .decapod/managed/specs/*.md while all generated attestations, manifests, governance artifacts, and persistent machine state remain CLI/RPC-owned; preserve validation and proof gates.",
  "destination": "dedicated PR for #1197",
  "current_phase": "verification",
  "next_transitions": [
    "inspect template source and reproduce the current wording contradiction",
    "publish",
    "publish dedicated PR and comment on issue #1197",
    "refresh governed projections and run validation"
  ],
  "active_boundaries": [
    "Do not weaken material living-spec or proof gates; do not create a new authoring authority or public command; do not mutate machine-owned .decapod state directly; do not alter databases."
  ],
  "repo_scope": [
    "Generated Decapod agent contract/template wording, linked agent documentation, living-spec contract guidance, focused tests, and governed publication artifacts."
  ],
  "inspected_files": [
    "assets/constitution.json",
    "docs/agent/contribution-conventions.md",
    "src/decapod/core/assets.rs",
    "src/decapod/core/validate.rs",
    "tests/entrypoint_correctness.rs"
  ],
  "modified_files": [
    ".decapod/governance/trajectory.json",
    ".decapod/governance/validation.json",
    ".decapod/managed/specs/INTERFACES.md",
    "assets/constitution.json",
    "docs/agent/contribution-conventions.md",
    "src/decapod/core/assets.rs",
    "src/decapod/core/validate.rs",
    "tests/entrypoint_correctness.rs"
  ],
  "declared_commands": [
    "cargo check --locked",
    "cargo clippy --locked --all-targets --all-features -- -D warnings",
    "cargo fmt --all",
    "cargo fmt --all -- --check",
    "cargo run --locked --bin decapod -- validate --format json --refresh-specs",
    "cargo test --locked --lib",
    "cargo test --locked --test entrypoint_correctness",
    "decapod validate"
  ],
  "tool_calls": [],
  "checks": [
    {
      "name": "cargo_check",
      "status": "passed"
    },
    {
      "name": "cargo_clippy",
      "status": "passed"
    },
    {
      "name": "cargo_fmt",
      "status": "passed"
    },
    {
      "name": "cargo_fmt_check",
      "status": "passed"
    },
    {
      "name": "cargo_lib_tests",
      "status": "partial"
    },
    {
      "name": "decapod validate",
      "status": "passed"
    },
    {
      "name": "decapod_validate",
      "status": "passed"
    },
    {
      "name": "entrypoint_contract_tests",
      "status": "partial"
    }
  ],
  "evidence": [
    "Decapod validation passed with fail_count=0; Clippy and formatting passed; library tests have four unrelated existing failures in dactyl_todo, governance artifact fixture setup, and container remote-fixture setup.",
    "New boundary regression test passed; three unrelated existing entrypoint-suite failures remain documented in the test output.",
    "validation epoch ve_bb6de00eff770e50 completed with zero failures"
  ],
  "shortcut_risk_signals": [],
  "unresolved_assumptions": [],
  "proof_status": "partial",
  "verdicts": {
    "intent_alignment": "supported",
    "boundary_discipline": "supported",
    "shortcut_risk": "supported",
    "completion_proof": "caution"
  },
  "artifact_hash": "sha256:8e86e544f6b974784f5d48635f4ffd99c2600f995586c1f259aae297d107b641",
  "custody": {
    "schema_version": "1.0.0",
    "intents": {
      "intent:feat_01m21n87eetm9caa": {
        "id": "intent:feat_01m21n87eetm9caa",
        "raw_intent": "Solve GitHub issue #1197 in a dedicated PR only if the solution fits the existing Decapod design: daemonless, workspace-isolated, agent-authored living specs, CLI-governed machine state, and proof-gated publication.",
        "refined_intent": "Narrow the generated instruction contract so agents may author semantic prose in .decapod/managed/specs/*.md while all generated attestations, manifests, governance artifacts, and persistent machine state remain CLI/RPC-owned; preserve validation and proof gates.",
        "acceptance_criteria": [],
        "constraints": [
          "Generated Decapod agent contract/template wording, linked agent documentation, living-spec contract guidance, focused tests, and governed publication artifacts."
        ],
        "assumptions": [],
        "boundaries": [
          "Do not weaken material living-spec or proof gates; do not create a new authoring authority or public command; do not mutate machine-owned .decapod state directly; do not alter databases."
        ],
        "out_of_scope": [],
        "proof_requirements": [],
        "status": "refined",
        "created_sequence": 1,
        "updated_sequence": 3
      }
    },
    "events": [
      {
        "sequence": 2,
        "event_id": "event:2",
        "intent_id": "intent:feat_01m21n87eetm9caa",
        "kind": "created"
      },
      {
        "sequence": 3,
        "event_id": "event:3",
        "intent_id": "intent:feat_01m21n87eetm9caa",
        "kind": "refined"
      },
      {
        "sequence": 4,
        "event_id": "event:4",
        "intent_id": "intent:feat_01m21n87eetm9caa",
        "kind": "trajectory_step_recorded",
        "detail": "trajectory:feat_01m21n87eetm9caa"
      },
      {
        "sequence": 5,
        "event_id": "event:5",
        "intent_id": "intent:feat_01m21n87eetm9caa",
        "kind": "trajectory_step_recorded",
        "detail": "trajectory:feat_01m21n87eetm9caa"
      },
      {
        "sequence": 6,
        "event_id": "event:6",
        "intent_id": "intent:feat_01m21n87eetm9caa",
        "kind": "trajectory_step_recorded",
        "detail": "trajectory:feat_01m21n87eetm9caa"
      }
    ],
    "trajectories": {
      "feat_01m21n87eetm9caa": {
        "id": "feat_01m21n87eetm9caa",
        "intent_id": "intent:feat_01m21n87eetm9caa",
        "evidence_only": true,
        "steps": [
          {
            "sequence": 4,
            "action": "implementation",
            "command": "cargo check --locked",
            "scope": [
              "Generated Decapod agent contract/template wording, linked agent documentation, living-spec contract guidance, focused tests, and governed publication artifacts."
            ],
            "observations": [
              "src/decapod/core/assets.rs",
              "src/decapod/core/validate.rs",
              "assets/constitution.json",
              "docs/agent/contribution-conventions.md",
              "tests/entrypoint_correctness.rs",
              "src/decapod/core/assets.rs",
              "src/decapod/core/validate.rs",
              "assets/constitution.json",
              "docs/agent/contribution-conventions.md",
              "tests/entrypoint_correctness.rs",
              ".decapod/managed/specs/INTERFACES.md",
              "New boundary regression test passed; three unrelated existing entrypoint-suite failures remain documented in the test output."
            ],
            "proof_refs": [
              "cargo_check",
              "cargo_fmt",
              "entrypoint_contract_tests"
            ],
            "validation_findings": [],
            "custody_event_id": "event:4"
          },
          {
            "sequence": 5,
            "action": "validation",
            "command": "decapod validate",
            "scope": [
              "Generated Decapod agent contract/template wording, linked agent documentation, living-spec contract guidance, focused tests, and governed publication artifacts."
            ],
            "observations": [
              ".decapod/governance/trajectory.json",
              ".decapod/governance/validation.json",
              "validation epoch ve_bb6de00eff770e50 completed with zero failures"
            ],
            "proof_refs": [
              "decapod validate"
            ],
            "validation_findings": [],
            "custody_event_id": "event:5"
          },
          {
            "sequence": 6,
            "action": "verification",
            "command": "cargo fmt --all -- --check",
            "scope": [
              "Generated Decapod agent contract/template wording, linked agent documentation, living-spec contract guidance, focused tests, and governed publication artifacts."
            ],
            "observations": [
              "Decapod validation passed with fail_count=0; Clippy and formatting passed; library tests have four unrelated existing failures in dactyl_todo, governance artifact fixture setup, and container remote-fixture setup."
            ],
            "proof_refs": [
              "cargo_fmt_check",
              "cargo_clippy",
              "cargo_lib_tests",
              "decapod_validate"
            ],
            "validation_findings": [],
            "custody_event_id": "event:6"
          }
        ]
      }
    },
    "summaries": {},
    "knowledge_candidates": [],
    "next_sequence": 6
  }
}